{
  "$schema": "https://json-schema.org/draft/2020-12/schema",
  "type": "object",
  "properties": {
    "config_version": {
      "type": "string",
      "const": "mc-config-1-proposed"
    },
    "sampler_version": {
      "type": "string",
      "const": "sha256-mulberry32-boxmuller-1"
    },
    "execution_version": {
      "type": "string",
      "const": "mc-execution-1-proposed"
    },
    "macro": {
      "type": "object",
      "properties": {
        "family": {
          "type": "string",
          "const": "latent_ar1"
        },
        "initial_state": {
          "type": "number"
        },
        "rho": {
          "type": "number",
          "exclusiveMinimum": -1,
          "exclusiveMaximum": 1
        },
        "innovation_spread": {
          "type": "number",
          "minimum": 0
        },
        "lower": {
          "type": "number"
        },
        "upper": {
          "type": "number"
        },
        "update_months": {
          "type": "array",
          "prefixItems": [
            {
              "type": "number",
              "const": 1
            },
            {
              "type": "number",
              "const": 13
            },
            {
              "type": "number",
              "const": 25
            },
            {
              "type": "number",
              "const": 37
            },
            {
              "type": "number",
              "const": 49
            }
          ],
          "items": false,
          "minItems": 5,
          "maxItems": 5
        }
      },
      "required": [
        "family",
        "initial_state",
        "rho",
        "innovation_spread",
        "lower",
        "upper",
        "update_months"
      ],
      "additionalProperties": false
    },
    "mappings": {
      "type": "object",
      "properties": {
        "demand": {
          "type": "object",
          "properties": {
            "transform": {
              "type": "string",
              "const": "exp_loading"
            },
            "loading": {
              "type": "number",
              "minimum": 0
            },
            "lower": {
              "type": "number",
              "exclusiveMinimum": 0
            },
            "upper": {
              "type": "number",
              "exclusiveMinimum": 0
            }
          },
          "required": [
            "transform",
            "loading",
            "lower",
            "upper"
          ],
          "additionalProperties": false
        },
        "ticket": {
          "type": "object",
          "properties": {
            "transform": {
              "type": "string",
              "const": "exp_loading"
            },
            "loading": {
              "type": "number",
              "minimum": 0
            },
            "lower": {
              "type": "number",
              "exclusiveMinimum": 0
            },
            "upper": {
              "type": "number",
              "exclusiveMinimum": 0
            }
          },
          "required": [
            "transform",
            "loading",
            "lower",
            "upper"
          ],
          "additionalProperties": false
        },
        "valuation_multiple": {
          "type": "object",
          "properties": {
            "transform": {
              "type": "string",
              "const": "request_multiple_plus_loading"
            },
            "loading": {
              "type": "number",
              "minimum": 0
            },
            "lower": {
              "type": "number",
              "exclusiveMinimum": 0
            },
            "upper": {
              "type": "number",
              "exclusiveMinimum": 0
            },
            "expand_bounds_to_request": {
              "type": "boolean",
              "const": true
            }
          },
          "required": [
            "transform",
            "loading",
            "lower",
            "upper",
            "expand_bounds_to_request"
          ],
          "additionalProperties": false
        }
      },
      "required": [
        "demand",
        "ticket",
        "valuation_multiple"
      ],
      "additionalProperties": false
    },
    "shared": {
      "type": "object",
      "properties": {
        "wage": {
          "type": "object",
          "properties": {
            "family": {
              "type": "string",
              "const": "triangular"
            },
            "min": {
              "type": "number",
              "exclusiveMinimum": 0
            },
            "mode": {
              "type": "number",
              "exclusiveMinimum": 0
            },
            "max": {
              "type": "number",
              "exclusiveMinimum": 0
            }
          },
          "required": [
            "family",
            "min",
            "mode",
            "max"
          ],
          "additionalProperties": false
        },
        "vehicle_opex": {
          "type": "object",
          "properties": {
            "family": {
              "type": "string",
              "const": "triangular"
            },
            "min": {
              "type": "number",
              "exclusiveMinimum": 0
            },
            "mode": {
              "type": "number",
              "exclusiveMinimum": 0
            },
            "max": {
              "type": "number",
              "exclusiveMinimum": 0
            }
          },
          "required": [
            "family",
            "min",
            "mode",
            "max"
          ],
          "additionalProperties": false
        }
      },
      "required": [
        "wage",
        "vehicle_opex"
      ],
      "additionalProperties": false
    },
    "decision": {
      "type": "object",
      "properties": {
        "marketing_effectiveness": {
          "type": "object",
          "properties": {
            "family": {
              "type": "string",
              "const": "triangular"
            },
            "min": {
              "type": "number",
              "exclusiveMinimum": 0
            },
            "mode": {
              "type": "number",
              "exclusiveMinimum": 0
            },
            "max": {
              "type": "number",
              "exclusiveMinimum": 0
            }
          },
          "required": [
            "family",
            "min",
            "mode",
            "max"
          ],
          "additionalProperties": false
        },
        "truck_service_delay_offset": {
          "type": "object",
          "properties": {
            "family": {
              "type": "string",
              "const": "discrete"
            },
            "values": {
              "minItems": 1,
              "type": "array",
              "items": {
                "type": "integer",
                "minimum": -9007199254740991,
                "maximum": 9007199254740991
              }
            },
            "probabilities": {
              "minItems": 1,
              "type": "array",
              "items": {
                "type": "number",
                "minimum": 0,
                "maximum": 1
              }
            }
          },
          "required": [
            "family",
            "values",
            "probabilities"
          ],
          "additionalProperties": false
        },
        "hiring_delay_offset": {
          "type": "object",
          "properties": {
            "family": {
              "type": "string",
              "const": "discrete"
            },
            "values": {
              "minItems": 1,
              "type": "array",
              "items": {
                "type": "integer",
                "minimum": -9007199254740991,
                "maximum": 9007199254740991
              }
            },
            "probabilities": {
              "minItems": 1,
              "type": "array",
              "items": {
                "type": "number",
                "minimum": 0,
                "maximum": 1
              }
            }
          },
          "required": [
            "family",
            "values",
            "probabilities"
          ],
          "additionalProperties": false
        },
        "ramp_offset": {
          "type": "object",
          "properties": {
            "family": {
              "type": "string",
              "const": "discrete"
            },
            "values": {
              "minItems": 1,
              "type": "array",
              "items": {
                "type": "integer",
                "minimum": -9007199254740991,
                "maximum": 9007199254740991
              }
            },
            "probabilities": {
              "minItems": 1,
              "type": "array",
              "items": {
                "type": "number",
                "minimum": 0,
                "maximum": 1
              }
            }
          },
          "required": [
            "family",
            "values",
            "probabilities"
          ],
          "additionalProperties": false
        }
      },
      "required": [
        "marketing_effectiveness",
        "truck_service_delay_offset",
        "hiring_delay_offset",
        "ramp_offset"
      ],
      "additionalProperties": false
    },
    "fixed_market_factors": {
      "type": "object",
      "properties": {
        "overhead_multiplier": {
          "type": "number",
          "const": 1
        },
        "service_variable_cost_multiplier": {
          "type": "number",
          "const": 1
        },
        "other_revenue_multiplier": {
          "type": "number",
          "const": 1
        },
        "other_direct_cost_multiplier": {
          "type": "number",
          "const": 1
        }
      },
      "required": [
        "overhead_multiplier",
        "service_variable_cost_multiplier",
        "other_revenue_multiplier",
        "other_direct_cost_multiplier"
      ],
      "additionalProperties": false
    },
    "provenance": {
      "type": "object",
      "propertyNames": {
        "type": "string"
      },
      "additionalProperties": {
        "type": "object",
        "properties": {
          "kind": {
            "anyOf": [
              {
                "type": "string",
                "const": "synthetic_historical"
              },
              {
                "type": "string",
                "const": "user_input"
              },
              {
                "type": "string",
                "const": "derived"
              },
              {
                "type": "string",
                "const": "assumed"
              },
              {
                "type": "string",
                "const": "simulated"
              }
            ]
          },
          "source": {
            "type": "string",
            "minLength": 1
          },
          "unit": {
            "type": "string",
            "minLength": 1
          }
        },
        "required": [
          "kind",
          "source",
          "unit"
        ],
        "additionalProperties": false
      }
    }
  },
  "required": [
    "config_version",
    "sampler_version",
    "execution_version",
    "macro",
    "mappings",
    "shared",
    "decision",
    "fixed_market_factors",
    "provenance"
  ],
  "additionalProperties": false
}
